Questions,Answers,tag
Web Design & Development,"Your website is likely your most important marketing tool. Two main functions go into creating a website—design and development. So how are they different? Website designers ensure the site is appealing and easy to interact with. They tend to focus on the more artistic aspects. Web developers focus more on the programming and technical aspects that help the website function. So that webpage you can access in less than six seconds? It probably has a good web developer behind it. It’s easy to ixnay web developers entirely and just focus on website design, but this may not be smart in the long run. A growing website could suffer without the help of a web developer. Ideally, having both can help your website look great and load faster so you can keep users engaged for longer periods of time. 👉🏻 Find Web Developers 👉🏻 Find Web Designers Hiring a professional marketing agency can save you time and a lot of headaches. You’re already busy managing your business, building customer relationships, and improving your brand presence. You could benefit from one less thing (or a few) to worry about. Determine the areas you’re weakest in or want to improve upon the most, and let one of our vetted marketing agencies do the heavy lifting for you. So you can focus on what’s most important. Find a reliable agency via Semrush Agency Partners Boost SEO results with powerful keyword research Free Keyword Research Tool  About cookies on this site Cookies used on the site are categorized and below you can read about each category and allow or deny some or all of them, except for Necessary Cookies which are required to provide core website functionality. When categories that have been previously allowed are disabled, all cookies assigned to that category will be removed from your browser.  You can see a list of cookies assigned to each category and detailed information on those cookies in the “Cookie Policy” tab. Cookie Policy. Necessary cookies Some cookies are required to provide core functionality. The website won't function properly without these cookies and they are enabled by default and cannot be disabled. Preferences Preference cookies enables the web site to remember information to customize how the web site looks or behaves for each user. This may include storing selected currency, region, language or color theme. Analytical cookies Analytical cookies help us improve our website by collecting and reporting information on its usage. Marketing cookies Marketing cookies are used to track visitors across websites to allow publishers to display relevant and engaging advertisements. Cookies used on the site are categorized and below you can read about each category and allow or deny some or all of them, except for Necessary Cookies which are required to provide core website functionality. When categories that have been previously allowed are disabled, all cookies assigned to that category will be removed from your browser.  You can see a list of cookies assigned to each category and detailed information on those cookies in the “Cookie Policy” tab. Cookie Policy. Necessary cookies Some cookies are required to provide core functionality. The website won't function properly without these cookies and they are enabled by default and cannot be disabled. Cookie generated by applications based on the PHP language. This is a general purpose identifier used to maintain user session variables. It is normally a random generated number, how it is used can be specific to the site, but a good example is maintaining a logged-in status for a user between pages. This cookie is used to store a user's authentication token. These cookies are used to suggest a correct user`s interface during the first visit. Used by many systems for Cross Site Request Forgery protection. Strictly necessary, as Used for Google single sign-on to provide main site functionality upon user's request. This cookie is used to store an interface language. The ""GCLB"" cookie is set by the Google Cloud Platform service to optimize performance of the website. The ""GCLB"" cookie is set by the Google Cloud Platform service to optimize performance of the website. The ""GCLB"" cookie is set by the Google Cloud Platform service to optimize performance of the website. The __cf_bm cookie is supported by Cloudflare and used by Vimeo Player. The player will not work without it. The cookie does not collect any personal data and any information collected is subject to one-way encryption. Used by Google reCaptcha for risk analysis. This cookie is written to help us with site security in preventing Cross-Site Request Forgery attacks. Used by CookieHub to store information about whether visitors have given or declined the use of cookie categories used on the site. Anonymous visitor identifier cookie for Intercom. Identifier for each unique browser session. The ""GCLB"" cookie is set by the Google Cloud Platform service to optimize performance of the website. Allows the website to recognise a visitor, in order to optimise the live chat functionality. Used by the social networking service, TikTok, for tracking the use of embedded services. A session storage object is used to share the necessary data between the signup flow pages. Used to store the last interacted toolkit in the sidebar for cases when any of the links are duplicated and not primary. Used in Content Outline Builder to provide seamless experience for unauthorised users. This kind of Cookie is used for the AB experiments and allows to show the same variant of the experiment for a user. Used to identify the device interacting with the Messenger in order to improve security. Cookie used for connection persistence and routing the request to proper server in server pool. This cookie is used for store default country in Listing Management tool. Used by many systems for Cross Site Request Forgery protection. Storage of visitor sessions. Used to track when the outdated browser notice was closed by the user. Used by the website to determine which support notifications the user has been shown. Preferences Preference cookies enables the web site to remember information to customize how the web site looks or behaves for each user. This may include storing selected currency, region, language or color theme. The __cf_bm cookie is supported by Cloudflare and used by Vimeo Player. The player will not work without it. The cookie does not collect any personal data and any information collected is subject to one-way encryption. Used by LinkedIn to store consent of guests regarding the use of cookies for non-essential purposes. Used by LinkedIn for routing. The cookie is set by Addthis which enables the content of the website to be shared across different networking and social sharing websites. A cookie that YouTube sets that measures your bandwidth to determine whether you get the new player interface or the old. This session storage key used by blog engine Gatsby for scroll position saving between page reloads. Saving status of notice. Responsible for showing the tooltip next to the blog header. A browser sends this cookie with requests to Google’s sites. The NID cookie contains a unique ID Google uses to remember your preferences and other information, such as your preferred language (e.g. English), how many search results you wish to have shown per page (e.g. 10 or 20), and whether or not you wish to have Google’s SafeSearch filter turned on. Analytical cookies Analytical cookies help us improve our website by collecting and reporting information on its usage. Used by SpeedCurve's LUX to collect Real User Monitoring (RUM) metrics This Cookie is used to determine if a lead used an Affiliate link from Berush program. This Cookie is used by affiliate partner to determine a source of registration (e.g. blog, widget, e.t.c.). Contains a unique identifier used by Google Analytics to determine that two distinct hits belong to the same user across browsing sessions. Contains a unique identifier used by Google Analytics to determine that two distinct hits belong to the same user across browsing sessions. The cookie is set by Addthis which enables the content of the website to be shared across different networking and social sharing websites. Inspectlet uses cookies to keep track of session information. These cookies are needed to accurately understand how visitors are navigating your website. Inspectlet uses cookies to keep track of session information. These cookies are needed to accurately understand how visitors are navigating your website. Used by Inspectlet to keep track of session information. These cookies are needed to accurately understand how visitors are navigating the website. Used by Inspectlet to keep track of session information. These cookies are needed to accurately understand how visitors are navigating the website. Used by Inspectlet to keep track of session information. These cookies are needed to accurately understand how visitors are navigating the website. Used to track user for amplitude. Used by Google Analytics to throttle request rate (limit the collection of data on high traffic sites). Used to throttle request rate. If Google Analytics is deployed via Google Tag Manager. Contains a unique identifier used by Google Analytics 4 to determine that two distinct hits belong to the same user across browsing sessions. This is set to identify a new user’s first session. It stores a true/false value, indicating whether this was the first time Hotjar saw this user. It is used by Recording filters to identify new user sessions. This cookie is used to detect the first pageview session of a user. This is a True/False flag set by the cookie. Microsoft User Identifier tracking cookie used by Bing Ads. It can be set by embedded microsoft scripts. Widely believed to sync across many different Microsoft domains, allowing user tracking. Used by the social networking service, TikTok, for tracking the use of embedded services. Used by the social networking service, TikTok, for tracking the use of embedded services. Cookie used to differentiate between the different tracking objects created for the session. The cookie is created when the javascript library is loaded. The cookie is updated each time. Cookie used to differentiate between the different tracking objects created for the session. Registers statistical data on users' behaviour on the website. Used for internal analytics by the website operator. We use TikTok to market ourselves using the TikTok cookie that collects data about behaviour and purchases on our website and to measure the effect of our advertising. This tracking is used to evaluate and measure how different campaigns and marketing strategies perform on TikTok. Used to identify a visitor. We use TikTok to market ourselves using the TikTok cookie that collects data about behaviour and purchases on our website and to measure the effect of our advertising. This tracking is used to evaluate and measure how different campaigns and marketing strategies perform on TikTok. Used to identify a visitor. Hotjar cookie. This cookie is set when the customer first lands on a page with the Hotjar script. It is used to persist the Hotjar User ID, unique to that site on the browser. This ensures that behavior in subsequent visits to the same site will be attributed to the same user ID. Used by Hotjar to hold current session data. Used to determine if Oribi analytics can be carried out on a specific domain. This cookie is set to let Hotjar know whether that user is included in the data sampling defined by your site's pageview limit. This cookie contains the page number of the session recording. Inspectlet uses cookies to keep track of session information. These cookies are needed to accurately understand how visitors are navigating your website. Used by Inspectlet to keep track of session information. These cookies are needed to accurately understand how visitors are navigating the website. Inspectlet uses the Cookies to keep a session information track. These Cookies are needed to accurately understand how visitors navigate the Website. Inspectlet uses the Cookies to keep a session information track. These Cookies are needed to accurately understand how visitors navigate the Website. Set by Google analytics to store ID's of experiments and sessions for A/B testing. This cookie is set by POWR for analytical purposes. This cookie is set by POWR for analytical purposes. Marketing cookies Marketing cookies are used to track visitors across websites to allow publishers to display relevant and engaging advertisements. Used by Google AdSense to understand user interaction with the website by generating analytical data. Used by Google's DoubleClick to serve targeted advertisements that are relevant to users across the web. Targeted advertisements may be displayed to users based on previous visits to a website. These cookies measure the conversion rate of ads presented to the user. This cookie carries out information about how the end user uses the website and any advertising that the end user may have seen before visiting the said website. This is a cookie that is set by twitter.com. It is used for optimizing ad relevance by collecting visitor navigation data. This is a Microsoft MSN 1st party cookie for sharing the content of the website via social media. Used by the social networking service, LinkedIn, for tracking the use of embedded services. Contains a unique identifier used by LinkedIn to determine that two distinct hits belong to the same user across browsing sessions. Used by LinkedIn to store information about the time a sync with the lms_analytics cookie took place for users in the Designated Countries. This is a cookie utilised by Microsoft Bing Ads and is a tracking cookie. It allows us to engage with a user that has previously visited our website. This is a cookie utilised by Microsoft Bing Ads and is a tracking cookie. It allows us to engage with a user that has previously visited our website. Used by Yahoo for content and advertising personalisation. Facebook Pixel advertising first-party cookie. Used by Facebook to track visits across websites to deliver a series of advertisement products such as real time bidding from third party advertisers. This cookie is associated with an email marketing service provided by Marketo. This tracking cookie allows a website to link visitor behavior to the recipient of an email marketing campaign, to measure campaign effectiveness. This is a cookie utilised by Microsoft Bing Ads and is a tracking cookie. It allows us to engage with a user that has previously visited our website. This is a cookie utilised by Microsoft Bing Ads and is a tracking cookie. It allows us to engage with a user that has previously visited our website. This is a cookie utilised by Microsoft Bing Ads and is a tracking cookie. It allows us to engage with a user that has previously visited our website. This is a cookie utilised by Microsoft Bing Ads and is a tracking cookie. It allows us to engage with a user that has previously visited our website. Set by Reddit to help build a profile of your interests and show you relevant ads. We use TikTok to market ourselves using the TikTok cookie that collects data about behaviour and purchases on our website and to measure the effect of our advertising. This tracking is used to evaluate and measure how different campaigns and marketing strategies perform on TikTok. Used to identify a visitor. To be able to unique identify a user for retargeting, conversion, or look-a-like purposes. To be able to unique identify a user for retargeting, conversion, or look-a-like purposes. To be able to unique identify a user for retargeting, conversion, or look-a-like purposes. To be able to unique identify a user for retargeting, conversion, or look-a-like purposes. To be able to unique identify a user for retargeting, conversion, or look-a-like purposes. To be able to unique identify a user for retargeting, conversion, or look-a-like purposes. This cookie is generally provided by amazon-adsystem.com for advertising purposes. This cookie is generally provided by amazon-adsystem.com for advertising purposes. Registers a unique ID to keep statistics of what videos from YouTube the user has seen. To be able to unique identify a user for retargeting, conversion, or look-a-like purposes. Used by LinkedIn to make a probabilistic match of a user's identity outside the Designated Countries To be able to unique identify a user for retargeting, conversion, or look-a-like purposes. To be able to unique identify a user for retargeting, conversion, or look-a-like purposes. To be able to unique identify a user for retargeting, conversion, or look-a-like purposes. Used to check if the user's browser supports cookies. To be able to unique identify a user for retargeting, conversion, or look-a-like purposes. To be able to unique identify a user for retargeting, conversion, or look-a-like purposes.",digital_marketing
Franchise SEO,"Amplify your market reach and improve your brand reputation with Thrive’s franchise SEO services. Our team creates a franchise marketing plan around your ideal prospects and service location. We claim and optimize your business listings, publish geo-modified service pages and blog posts, ensure brand consistency and garner positive online reviews from your best customers. In this way, we help you manage and promote all your franchisees and secure high local rankings.",digital_marketing
Amazon Marketing Services (AMS),"Getting found on Amazon is not easy! Competition is fierce and thick, so you need to find the right digital marketing company to strengthen your AMS strategy. At Thrive, we help your products get found in this massive marketplace. Our Amazon marketing experts combine the best Amazon SEO, Amazon PPC and Amazon storefront and branding practices to deliver valuable results. We develop your keyword strategy and optimize your product listings to lower your advertising cost of sales (AcoS).",digital_marketing
eCommerce Marketing,"The eCommerce industry generates 23 percent YoY in revenue. Take advantage of a whole range of opportunities in the eCommerce business to promote your products and offer round the clock convenience to your customers. Our internet marketing company provides eCommerce SEO and eCommerce PPC solutions to drive top-of-funnel traffic to your website. We generate more product reviews, optimize your product pages and personalize your marketing strategies based on your customer needs.",digital_marketing
Technical SEO,"Establish a strong online foundation with on-point technical SEO and internet marketing services. Our technical SEO experts run crawl error reports, check your HTTPS status codes, optimize your site speed, audit redirects and eliminate duplicate content. In doing so, we increase your website’s crawlability and indexability. We also add structured data markup to your website and facilitate site migration, depending on your needs and requirements.",digital_marketing
