Questions,Answers,tag
Security Testing,"While talking about testing the security, this is the time you should go for special testing. It is because mobile app security is the top concern of any enterprise. A little vulnerability or security risk can lead the app to hack. Most companies hire experts for their mobile app development security testing. It is because the QA and the development teams can perform minimal testing through app development. You should use a trusted mobile app development service from the beginning of the development. For example, iOS apps provide the Keychain feature for storing a user’s account details. So, make sure you have chosen efficient services and their features to ensure no data leakage.",mobile
Configuration Testing,"Configuration testing in mobile app development comprises app configuration for all the devices. It is also necessary to check the ultimate performance of the app in this stage. See if the app is missing any features that don’t work with specific devices. Also, perform the following tests:",mobile
Platform Testing,"Platform testing is inevitable for mobile application development. This is because there are always new devices coming with the change of technology. However, these technologies bring new features with new hardware. So, make sure your app will be compatible with future technologies and the changes. Then perform platform testing by considering the following aspects.",mobile
Recovery Testing,"There are no such applications that don’t face unwanted errors or failures. The error can occur from hardware or software. So, every mobile application must have the power to recover from any kind of error. Therefore, you can’t deny the importance of recovery testing in your mobile app development.",mobile
Certification Testing,Testing certification checks if the app meets the standards of app stores like Google Play or Apple App Store. This is the final and very crucial for any mobile app development process. Things you might consider in certification testing are:,mobile
Monitoring and Testing the Performance,"Monitor and improve! It is the most important thing to make your app stand out. Do this until your app reaches its ultimate goal. It is also part of your mobile app development. Also, monitor the lags, loading types, Keep an eye on loading types, and the other issues to improve the performance.",mobile
Updating User Interface,"The style, trends, habits vary from user to user. So, updating the user interface is crucial for any mobile application. Besides, there are many essential features of the apps that need regular updates. The same interface may result in losing customers.",mobile
Make it Supportive for Latest Hardware & Software,"Every year there is a new version of the mobile operating system. For adopting newer technologies, manufacturers update the operating systems and features. So, you need to develop your mobile application with keeping future technologies in mind. Also, make sure your app is suitable for the latest software and hardware.",mobile
Fixing Bugs,"Bugs are the real obstacle to win customers. Mobile app users always prefer the smooth running of the app. So, you must ensure that there are no bugs in the application. But, bugs are also part of mobile app development. However, always try to fix them to keep your customers happy.",mobile
Update New Features Regularly,"If you always want to hold your users, you need to add new features to your app to attract them. First, take a good look at how your users are interacting with your app. Then, try to add all the exciting features based on the results of the observation. This will help you increase the number of your audience. And you will also get better app usage and performance. What will be the overall cost of developing a mobile app in this digital age of 2021? Naturally, this is a logical question. At least you need to know this very well before you go to create an app. There are many costs involved in mobile app development. Otherwise, you may not be able to launch your app successfully. So, let’s look at the overall cost of mobile app development and which costs you must think about.",mobile
Planning and Pre-Research Stage Cost,"According to different mobile app development companies, about $5000 (five thousand dollars) will be needed in an enterprise mobile app development planning stage. It is the stage when your developer provides you the best concept for your mobile app development.",mobile
UI/UX Design Stage Cost,The minimum cost of UX/UI design is $5000 (five thousand dollars). And it may range from $40-50k (forty to fifty thousand dollars) for an average custom mobile app development. But UI/UX design cost depends on the client’s requirements and the platforms.,mobile
Development Stage Cost,"Development is the main stage of mobile app development. Therefore, you will need to spend most of your money at this stage. Generally, a custom business mobile app development stage will cost $20k to $50k (twenty to fifty thousand dollars).",mobile
Testing and Deployment Stage Cost,"Testing and deployment are inevitable for successful mobile software development. So, this stage also requires a massive amount of money. On average, $10k-$25k (Ten to twenty-five thousand dollars) will be needed to test and deploy an application.",mobile
Managed IT Services,"A wide, all-encompassing type of service, managed IT is usually a part of an MSP (managed service provider) which deals with single or multiple IT service needs. Most commonly, managed IT services handle remote server, desktop, and device management. Other common uses involve remote cybersecurity.",itservices
Cloud Backup Services,"The cloud is a versatile platform capable of supporting numerous virtual services, such as operating systems and programs. Cloud backups are one part of the service model too, allowing users and companies to store their important information on external cloud servers, circumventing hardware failure or other problems. Cloud backup is typically handled by service providers for monthly/annual fees.",itservices
VoIP (Voice Over Internet Protocol),"The internet and broadband connections allow for versatile communication methods, and VoIP is one of them. This IT service utilizes a business/person’s internet in place of a traditional telephone line, allowing said user to make and receive calls with their ISP. Modern VoIP phones also provide a variety of functions, like voice call and chat options. Typically, VoIP’s also require a service subscription instead of a traditional phone service.",itservices
Monitoring Services,"Similar to security services and also found with an MSP, a monitoring application does as it sounds: keeps an eye on servers, net traffic, communication, security, and/or anything needed by an enterprise. This service is often employed for smaller companies who lack the resources of larger organizations but still require robust IT support/features. Responsibilities can range from automatically updating software/anti-virus to monitoring the integrity of hardware with SMART programs.",itservices
Data Backup and Restoration,"Some providers offer data backup with cloud or others with external data centers. Regardless of the method used, data backup involves the preservation of information in case of unforeseen problems, such as natural disaster, malicious intrusions, hardware failure, and more. Often a business refers to this as a “BDR strategy” (backup disaster recovery). For most organizations, having some form of backup is mandatory in order to prevent issues like downtime and critical information loss.",itservices
Firewall Services,"Firewalls are a common, integral part of any cybersecurity plan. Most companies handle their own or have a firewall for their network – but in some cases will elect a third party for additional firewall options. Options vary based on the provider. Some firewalls are hybrid models, for instance, which allow for additional control and network monitoring options outside of the normal rulesets. Others may provide a single firewall solution for all internal/remote devices. The needs differ based on the requirements of each individual company.",itservices
Cybersecurity Services,"A broad category involving any and all service types falling under the umbrella of cybersecurity.  In IT, it’s the act of protecting networks and data from malicious attacks by deploying a variety of methods, from network monitoring, firewalls, anti-virus, layered networks, and more. Often managed through a provider, it can also be handled on-site. Cybersecurity services are valuable as they draw from larger resources and more experienced staff. Among IT service options, the importance of cybersecurity cannot be stressed enough.",itservices
Office 365/Email,Office 365 operates as Microsoft’s all-inclusive software package featuring programs like Word and Excel. This is an excellent option for businesses that need diverse software for document organization reasons but would prefer to pay a monthly fee. Also known as a SaaS (software as a service) model. Office 365 also operates as a cloud server and updated email management platform. Office 365 is good for a company relying on emails for communication with a need for organization.,itservices
Anti-Virus Protection,"A subset of cybersecurity, anti-virus services are perhaps one of the most common types of IT service found in the industry. Mandatory, anti-malware protection comes in the form of software and/or monitoring. Because of the evolving threat malware presents in the modern world, any company relying on IT must have some form of anti-virus installed or service used.",itservices
Business Intelligence,"Big data plays an enormous role in business success. The downpour of information available to a given company is tremendous and how it’s acquired depends on the tool used. Services that encompass business intelligence analyze, extract, and transform this flood of info into meaningful reports. Anything from financial costs to click-through rates on an article at a certain time of day fall under the umbrella of modern business intelligence.",itservices
Remote Support,"As the name implies, remote support allows for IT specialists to offer support services from a different location, sometimes controlling a device to assist with troubleshooting issues via the internet. Support can be used for IT assistance, software repair, or other needs. Very useful when IT experts are not physically available, generally handled by an MSP.",itservices
Microsoft Azure,"This is Microsoft’s own cloud platform, for public and private use (previously known as Windows Azure). The Azure platform offers a robust array of options for development, IoT, analytics, security, and more. It’s highly popular because Azure charges based on use (pay as you go) instead of a flat fee, which is a good flexible choice for businesses with limited financial capital.",itservices
Mobile and Remote Networking,"Mobile and remote networking allows staff to work from mobile devices and/or remote devices, typically off-site from a physical location. Coincides with BYOD (bring your own device) policies. This is handy because it offers a great range of flexibility for workers, and also allows them to work on projects from virtually anywhere. Useful if a company location is inaccessible for unforeseen reasons.",itservices
Communication Management,"IT services handling all communication services often provide universal communication solution platforms for companies. A UC platform is a type of software incorporating all types of messaging, from chat, email, voice, video call, and even email. Communication management also involves the planning of a communication system, such as the etiquette and guidelines for sending/receiving emails. For instance, a company may only allow business sensitive information to be kept on company emails.",itservices
SaaS (Software as a Service),"A broad term which can involve any and all software which is paid for via monthly subscription services. In IT, said software is provided by a third-party over the internet. Extremely basic examples include email. Office 365, a service we previously listed, would fall under the SaaS category.",itservices
Unified Communications,"Unified communications involve the software and planning of bringing all communication methods together in a single space. As mentioned, examples of this include UC software. This can either be managed by a business or a service provided by an MSP.",itservices
Data Analytics,"Services which incorporate the act of analyzing and digesting data for company use, data analytics will typically involve concepts like “big data” and IoT (the Internet of Things). Involves specialists and services which process information for a company in order to produce usable reports. These reports utilize anything beneficial to the business.",itservices
Networking Services,"Networking IT services encompasses everything for the successful implementation of a company network. This involves the building of network infrastructure, the setup of devices like LAN routers and modems, the layout of the networks (such as breaking a network into different tiers), security, optimization, and many other factors. Often a business will build this on-site, however, if local IT experts are insufficient (or unavailable) then third parties are used for the proper implementation of services.",itservices
IT Development,"IT development incorporates all the resources used to develop and manage a platform or software. When using services, third-party assistance can be brought on to aid in the completion of projects, or any of the various tasks required for the completion of software. Some of those services include QA testing, business solutions, migration, application development, and application maintenance. Generally, when not handled by on-site staff, remote assistance is for short-term projects. Sometimes these are referred to as “shadow developers.”",itservices
Printing IT Services,"Printing IT services includes all services associated with the management, recording, and printing of documentation. Normally handled by a business in-house, but in rare cases where additional help is required, a third party can manage high volumes of printing requests, maintain backups of documentation, and organize said documentation in virtual spreadsheets. Now that you have a better understanding of the various IT services available, you may wonder if any of them are right for your enterprise. There’s no exact answer because every organization has its own unique needs, and naturally, investing in third party resources can seem like an uncertain investment. However, not all companies have the same resources as larger businesses, and when IT is essential to remain competitive, you can easily feel left behind. So, go over the following when considering third-party solutions: If any of these situations apply to your business, it’s probably time to seek IT services through a managed provider. Often, internal problems and instability lead to lost hours and ultimately hurt profit margins. Imagine, for instance, how a universal communication platform can help by centralizing how all staff communicates. Instead of Jerry from accounting missing an email because he was in a meeting, the software can indicate where he was and what he was doing at that time. The less time the staff spends running after each other in this scenario, the more time they can focus on their tasks. This is just one example among dozens which can offer resolutions to headache-inducing problems.",itservices
Front-End Development,"Front-end development involves creating the user-facing interface of a website or web application. It focuses on implementing engaging and interactive designs using HTML, CSS, and JavaScript.   Skilled front-end developers ensure that the website’s layout, navigation, and visual elements provide an intuitive and seamless user experience. Thus, front-end developers help businesses create a unique and cohesive brand experience, ensuring consistency in design elements, colors, typography, and overall aesthetics. As a result, this can enhance the brand perception among users.",webdevelopment
Backend Development,"Backend development focuses on the server-side aspects of the web development process. It involves building the underlying infrastructure, managing databases, processing requests, and handling the business logic that powers the website or web application.   Backend developers work with programming languages like Python, PHP, Java, and Ruby on Rails, along with frameworks and technologies that enable efficient server-side development.   Backend development services allow businesses to implement complex business rules, calculations, and workflows. They handle processes such as order processing, payment handling, data validation, and other custom functionalities specific to a business’s needs.   Furthermore, backend development enables the implementation of user authentication and authorization systems. This includes user registration, login mechanisms, password management, and user roles/permissions. These features are crucial for securing user data and controlling access to specific resources or functionalities within the website or application.",webdevelopment
Full-Stack Development,"Full-stack development involves both front-end and backend development. Therefore, full-stack developers possess a broad skill set that allows them to handle all layers of web application development. They are proficient in multiple programming languages, frameworks, and technologies required to build end-to-end web solutions.   Due to their versatile skills, full-stack developers are well-suited for rapid prototyping and Minimum Viable Product (MVP) development. They can quickly create functional prototypes that demonstrate core features and validate concepts. This allows businesses to gather feedback, test ideas, and iterate efficiently before investing further in development.   When working with larger development teams, full-stack developers act as a bridge between front-end and back-end developers through any development stage. They have a deep understanding of both sides of the application, facilitating effective collaboration, communication, and problem-solving between team members.",webdevelopment
Web Design,"Web design is the process of creating visually appealing and engaging interfaces for websites or web applications. It involves the selection of color schemes, typography, graphic elements, and layout to provide a cohesive and attractive user experience. Web designers focus on creating designs that align with the brand identity, usability best practices, and the target audience’s expectations.   Businesses opt for web design primarily to create new websites or redesign existing ones. Web designers collaborate with stakeholders to understand their requirements and objectives, translating them into visually compelling designs. They consider factors such as user experience, branding, and overall aesthetics to create an appealing and functional website.",webdevelopment
Responsive Web Development,"Responsive web development services yield websites that adapt and provide an optimal viewing experience across a variety of devices and screen sizes. This web solution utilizes flexible grids, media queries, and other techniques to ensure a consistent and user-friendly experience across different platforms.   Furthermore, responsive web development services contribute to improved website functionality and better accessibility for all users, including those with disabilities. By designing websites that respond to different screen sizes and assistive technologies, businesses can ensure that all users can access and engage with their content effectively.   In addition to providing an optimal user experience on any device, responsive web development helps businesses improve their website’s ranking factor in search engine algorithms, potentially improving organic search visibility and driving more organic traffic to the site.",webdevelopment
Mobile Web Development,"Mobile web development focuses on creating websites specifically tailored for optimal viewing and functionality on mobile devices. It involves developing and designing websites with mobile-specific features, user interfaces, and performance optimizations.   Mobile web development ensures that websites are fast, user-friendly, and compatible with the constraints and capabilities of mobile devices. Such websites often have a simplified layout, streamlined content, and touch-friendly navigation to provide a seamless browsing experience on smaller screens.",webdevelopment
eCommerce Development,"eCommerce development is the process of creating online stores that facilitate buying and selling of products or services over the Internet. It creates websites or custom web applications with features and functionalities tailored for online transactions, inventory management, secure payments, and order processing and fulfillment.   Besides that, eCommerce development often integrates customer relationship management functionalities. CRM systems enable businesses to capture customer information, track order histories, provide personalized recommendations, and engage with customers through email marketing or customer support tools.",webdevelopment
Content Management System (CMS) Development,"Content Management System (CMS) development services help businesses create web-based platforms that enable businesses to manage and publish digital content easily. Thus, content management systems provide a user-friendly interface for creating, editing, organizing, and publishing content on websites without requiring technical expertise.   Furthermore, content management system development includes user management features. This allows businesses to control access and permissions for different user roles. Businesses can grant specific users or teams the ability to create, edit, and publish content while enforcing security measures to protect sensitive information.",webdevelopment
Progressive Web Apps (PWAs) Development,"Progressive Web Apps (PWAs) are web applications that leverage modern web technologies to deliver an app-like experience to users across different devices and platforms.   PWAs are commonly developed as alternatives to traditional native mobile applications. Businesses can offer a consistent and optimized user experience across different mobile devices by understanding the various services without the need for separate iOS and Android app development.   PWAs are developed using technologies like HTML, CSS, and JavaScript, making them accessible through web browsers without the need for app store distribution. They are great for custom eCommerce solutions as they offer a native app-like experience for online shopping.   Besides that, PWAs can be used for developing booking and reservation systems for various industries, including hotels, restaurants, travel agencies, and event management. Finally, PWAs can be developed as productivity and collaboration tools, enabling users to work on documents, share files, and collaborate in real time.",webdevelopment
Single-Page Application (SPA) Development,"A Single-Page Application, or SPA for short, is a web application that loads and interacts with the user dynamically on a single web page. Unlike traditional multi-page websites, SPAs dynamically update content without requiring full-page reloads. SPAs rely on JavaScript frameworks such as React, Angular, or Vue.js to manage the application state and handle client-side rendering.   SPAs are commonly used for developing complex web apps that require high interactivity and real-time data updates. Examples include project management tools, social media platforms, collaborative editors, news feeds, and data visualization dashboards. SPAs provide a seamless user experience by updating specific parts of the page without refreshing the entire interface.",webdevelopment
API Development,"API (Application Programming Interface) development involves creating sets of rules and protocols that allow different software applications to communicate and interact with each other. It focuses on designing, building, and documenting APIs that provide specific functionalities or access to resources.   API development is commonly used to integrate third-party services. Many businesses rely on APIs provided by popular platforms and services such as social media networks, payment gateways, mapping services, and more. As a result, APIs allow businesses to access and leverage external functionalities, thus enhancing the capabilities of their own web-based solutions.   As mobile applications often rely on APIs to access data, services, or functionalities from servers or cloud-based systems, API development also plays a crucial role in mobile app development. APIs allow mobile applications to interact with backend systems, authenticate users, retrieve data, and perform various operations.   Furthermore, API development is integral to the implementation of microservices architecture, where applications are composed of multiple small, independent services. It also facilitates the integration of IoT devices and systems.",webdevelopment
Database Development,"Database development takes care of the design, creation, and management of structured collections of data that are organized and stored in a database management system (DBMS). It focuses on creating efficient, reliable, and scalable databases that meet the specific needs of businesses. This includes designing database schemas, defining relationships between data entities, optimizing query performance, and ensuring data integrity and security.",webdevelopment
